<?xml version="1.0" encoding="UTF-8"?>
<!DOCTYPE formProgram 
[   <!ELEMENT formProgram (properties, remark, content)>
   <!ATTLIST formProgram sw CDATA #REQUIRED>
   <!ATTLIST formProgram formatVersion CDATA #REQUIRED>
   <!ELEMENT properties (fpo, fileName, fileDate, userName, firm, machineType, machineId, softwareVersion, customerOrder, formProg, formIdent, castingIdent, shiftNumber?, sumCycJob?, qualityAttribute?, unit, language)>
   <!ELEMENT content (programName, programGroup*, hmiSetup*, storageDeviceMapping?)>
   <!ELEMENT programGroup (groupId, groupName?, remark?, par*)>
   <!ELEMENT hmiSetup (setupId, setupName, remark, setupFunction*)>
   <!ELEMENT setupFunction (functionId, par*)>
   <!ELEMENT storageDeviceMapping (par*)>

   <!ELEMENT remark (#PCDATA)>
   <!ELEMENT fpo (#PCDATA)>
   <!ELEMENT fileName (#PCDATA)>
   <!ELEMENT fileDate (#PCDATA)>
   <!ELEMENT userName (#PCDATA)>
   <!ELEMENT firm (#PCDATA)>
   <!ELEMENT machineType (#PCDATA)>
   <!ELEMENT machineId (#PCDATA)>
   <!ELEMENT softwareVersion (#PCDATA)>
   <!ELEMENT customerOrder (#PCDATA)>
   <!ELEMENT formProg (#PCDATA)>
   <!ELEMENT formIdent (#PCDATA)>
   <!ELEMENT castingIdent (#PCDATA)>
   <!ELEMENT shiftNumber (#PCDATA)>
   <!ELEMENT sumCycJob (#PCDATA)>
   <!ELEMENT qualityAttribute (#PCDATA)>
   <!ELEMENT unit (#PCDATA)>
   <!ELEMENT language (#PCDATA)>
   <!ELEMENT programName (#PCDATA)>
   <!ELEMENT groupId (#PCDATA)>
   <!ELEMENT groupName (#PCDATA)>
   <!ELEMENT par (#PCDATA)>
   <!ELEMENT setupId (#PCDATA)>
   <!ELEMENT setupName (#PCDATA)>
   <!ELEMENT functionId (#PCDATA)>
   ]>
<formProgram sw="DV_Fusion" formatVersion="1.0.0">
  <properties>
    <fpo>CFG_FORM_PROGRAM</fpo>
    <fileName>pro_700095307_250905-Orion-EndofDay.xml</fileName>
    <fileDate>2025-09-05T15:12:46.985Z</fileDate>
    <userName>AAA-Jonas</userName>
    <firm>Application / Innovation / Training Center</firm>
    <machineType>F140</machineType>
    <machineId>700095307</machineId>
    <softwareVersion>rx-5.3.3.0</softwareVersion>
    <customerOrder>Job 700095307 2021-02-17 / 00</customerOrder>
    <formProg>700095307_250905-Orion-EndofDay</formProg>
    <formIdent>Fliesslaengenform</formIdent>
    <castingIdent>Fliesslaengerform Buehler</castingIdent>
    <shiftNumber></shiftNumber>
    <unit>ISO Absolute</unit>
    <language>de</language>
  </properties>
  <remark></remark>
  <content>
    <programName>700095307_250905-Orion-EndofDay</programName>
    <programGroup>
      <groupId>at_VG_FORMPROGRAMM</groupId>
      <par>ab_ablauf.svABprocess.AB_SW_DMXFX=0</par>
      <par>ab_ablauf.svABprocess.AB_SW_DOOR_SERIAL=1</par>
      <par>ab_ablauf.svABprocess.AB_SW_DOSGWB=0</par>
      <par>ab_ablauf.svABprocess.AB_SW_EBCK=2</par>
      <par>ab_ablauf.svABprocess.AB_SW_EBCK_mEnt_mSpr=2</par>
      <par>ab_ablauf.svABprocess.AB_SW_EBCK_mEnt_oSpr=0</par>
      <par>ab_ablauf.svABprocess.AB_SW_EBCK_oEnt_mSpr=0</par>
      <par>ab_ablauf.svABprocess.AB_SW_EBCK_oEnt_oSpr=0</par>
      <par>ab_ablauf.svABprocess.AB_SW_EER=1</par>
      <par>ab_ablauf.svABprocess.AB_SW_EFOR=2</par>
      <par>ab_ablauf.svABprocess.AB_SW_FTOUT=2</par>
      <par>ab_ablauf.svABprocess.AB_SW_IBCK=1</par>
      <par>ab_ablauf.svABprocess.AB_SW_LOCKCL=0</par>
      <par>ab_ablauf.svABprocess.AB_SW_PS_NOINS=0</par>
      <par>ab_ablauf.svABprocess.AB_T_EBCK=5000000</par>
      <par>ab_ablauf.svABprocess.AB_T_EFOR=0</par>
      <par>ab_ablauf.svABprocess.AB_T_GEPS02_MSOL_R=0</par>
      <par>ab_ablauf.svABprocess.AB_T_IBCK=30000000</par>
      <par>ab_ablauf.svABprocess.AB_T_LUBTO=900000000</par>
      <par>ab_ablauf.svABprocess.AB_T_MSOL=3000000</par>
      <par>ab_ablauf.svABprocess.AB_T_PAUSE=0</par>
      <par>at_akkumulti.svATprocess.RE_DIFP_NACC=20.0</par>
      <par>at_akkumulti.svATprocess.RE_DIFP_NMUL=20.0</par>
      <par>at_akkumulti.svATprocess.RE_P_NACC=130.0</par>
      <par>at_akkumulti.svATprocess.RE_P_NMUL=200.0</par>
      <par>au_auswerfer.svAUprocess.AU31_REAR_LIMITSWITCH=0</par>
      <par>au_auswerfer.svAUprocess.AU_N_E=1</par>
      <par>au_auswerfer.svAUprocess.AU_P_EBCK=60.0</par>
      <par>au_auswerfer.svAUprocess.AU_P_EVOR=70.0</par>
      <par>au_auswerfer.svAUprocess.AU_SW_E_2=0</par>
      <par>au_auswerfer.svAUprocess.AU_SW_E_DIE=0</par>
      <par>au_auswerfer.svAUprocess.AU_S_E_ERR=20.0</par>
      <par>au_auswerfer.svAUprocess.AU_S_E_FIN=15.0</par>
      <par>au_auswerfer.svAUprocess.AU_S_E_REP=10.0</par>
      <par>au_auswerfer.svAUprocess.AU_S_E_WP1=5.0</par>
      <par>au_auswerfer.svAUprocess.AU_V_EBCK=3.0</par>
      <par>au_auswerfer.svAUprocess.AU_V_EVOR=1.0</par>
      <par>cm_cellmanager.svCMprocess.CM_S_FORMPOSMIN=100.0</par>
      <par>cu_div_spz.svCUprocess.CU_NR_PENR01_ID=0</par>
      <par>cu_div_spz.svCUprocess.CU_SW_PEWA01=0</par>
      <par>cu_div_spz.svCUprocess.CU_SW_SEFK11=0</par>
      <par>cu_div_spz.svCUprocess.CU_SW_SEFK11_PS=1</par>
      <par>cu_div_spz.svCUprocess.CU_SW_SEFS03=0</par>
      <par>cu_div_spz.svCUprocess.CU_S_SEFK11_S0=150.0</par>
      <par>cu_div_spz.svCUprocess.CU_T_PEPO05_TRIG=60000000</par>
      <par>cu_div_spz.svCUprocess.CU_T_SEFK11_T0=0</par>
      <par>cu_div_spz.svCUprocess.CU_T_SEFS03_T0=0</par>
      <par>cu_div_spz.svCUprocess.CU_T_SEFS03_T1=0</par>
      <par>cu_div_spz.svCUprocess.CU_T_SEFS03_T2=0</par>
      <par>cu_div_spz.svCUprocess.CU_T_SEFS03_T3=0</par>
      <par>cu_div_spz.svCUprocess.EN07_SW_GKCTR=0</par>
      <par>cu_div_spz.svCUprocess.EN07_SW_LACTR=0</par>
      <par>cu_div_spz.svCUprocess.EN07_SW_ROTPRG=0</par>
      <par>cu_div_spz.svCUprocess.EN07_SW_VZCTR=0</par>
      <par>cu_div_spz.svCUprocess.FK11_N_CYC_JC2_WAITFKIBAA=0</par>
      <par>cu_div_spz.svCUprocess.FK11_N_CYC_JC3_WAITFKIBAA=0</par>
      <par>cu_div_spz.svCUprocess.FK11_N_CYC_JC4_WAITFKIBAA=0</par>
      <par>cu_div_spz.svCUprocess.FK11_N_CYC_JC5_WAITFKIBAA=0</par>
      <par>cu_div_spz.svCUprocess.FK11_N_CYC_WAITFKIBAA=0</par>
      <par>cu_div_spz.svCUprocess.FK11_SW_JC2_PS=0</par>
      <par>cu_div_spz.svCUprocess.FK11_SW_JC_2=0</par>
      <par>cu_div_spz.svCUprocess.FK11_S_JC2_S0=1.0</par>
      <par>cu_div_spz.svCUprocess.FK11_T_FK2RECDAT=0</par>
      <par>cu_div_spz.svCUprocess.FK11_T_FKRECDAT=0</par>
      <par>cu_div_spz.svCUprocess.FK11_T_JC2_FKIBAA=0</par>
      <par>cu_div_spz.svCUprocess.FK11_T_JC2_T0=0</par>
      <par>cu_div_spz.svCUprocess.FK11_T_JC_FKIBAA=0</par>
      <par>cu_div_spz.svCUprocess.PW25_SW_P_ANA1=0</par>
      <par>cu_div_spz.svCUprocess.PW25_SW_P_ANA10=0</par>
      <par>cu_div_spz.svCUprocess.PW25_SW_P_ANA11=0</par>
      <par>cu_div_spz.svCUprocess.PW25_SW_P_ANA12=0</par>
      <par>cu_div_spz.svCUprocess.PW25_SW_P_ANA13=0</par>
      <par>cu_div_spz.svCUprocess.PW25_SW_P_ANA14=0</par>
      <par>cu_div_spz.svCUprocess.PW25_SW_P_ANA15=0</par>
      <par>cu_div_spz.svCUprocess.PW25_SW_P_ANA2=0</par>
      <par>cu_div_spz.svCUprocess.PW25_SW_P_ANA3=0</par>
      <par>cu_div_spz.svCUprocess.PW25_SW_P_ANA4=0</par>
      <par>cu_div_spz.svCUprocess.PW25_SW_P_ANA5=0</par>
      <par>cu_div_spz.svCUprocess.PW25_SW_P_ANA6=0</par>
      <par>cu_div_spz.svCUprocess.PW25_SW_P_ANA7=0</par>
      <par>cu_div_spz.svCUprocess.PW25_SW_P_ANA8=0</par>
      <par>cu_div_spz.svCUprocess.PW25_SW_P_ANA9=0</par>
      <par>cu_div_spz.svCUprocess.PW25_SW_P_DIG1=0</par>
      <par>cu_div_spz.svCUprocess.PW25_SW_P_DIG2=0</par>
      <par>cu_div_spz.svCUprocess.PW25_SW_P_DIG3=0</par>
      <par>cu_div_spz.svCUprocess.PW25_SW_P_DIG4=0</par>
      <par>cu_div_spz.svCUprocess.PW25_SW_P_DIG5=0</par>
      <par>cu_div_spz.svCUprocess.PW25_SW_P_DIG6=0</par>
      <par>cu_div_spz.svCUprocess.TR10_M_INSERTS=0</par>
      <par>cu_div_spz.svCUprocess.TR10_N_CHANGMTR=0</par>
      <par>cu_div_spz.svCUprocess.TR10_N_INCR=0</par>
      <par>cu_div_spz.svCUprocess.TR10_N_PCSTOT=0</par>
      <par>cu_div_spz.svCUprocess.TR10_SW_CTRROBAD=0</par>
      <par>cu_div_spz.svCUprocess.TR10_SW_INSACYC=0</par>
      <par>cu_div_spz.svCUprocess.TR10_SW_INSBEFCNP=0</par>
      <par>en_entstd.svENprocess.EN08_SW_ARCORE=0</par>
      <par>fa_formabstuetzung.svFAprocess.FA_SW_D_SUPP_F=1</par>
      <par>fa_formabstuetzung.svFAprocess.FA_SW_D_SUPP_M=1</par>
      <par>fa_formabstuetzung.svFAprocess.FA_SW_D_SUPP_VHMI=0</par>
      <par>fa_formabstuetzung.svFAprocess.FA_SW_MIDPL_MS=0</par>
      <par>fh_formhoehe.svFHprocess.FH_S_D=880</par>
      <par>fh_formhoehe.svFHprocess.FH_S_DREF=669</par>
      <par>fk27_formkuehl.svFK34HK1process.FK34_CirX_Data[1].FK34_SW_CIR=0</par>
      <par>fk27_formkuehl.svFK34HK1process.FK34_CirX_Data[1].FK34_SW_FW_S1=0</par>
      <par>fk27_formkuehl.svFK34HK1process.FK34_CirX_Data[1].FK34_SW_FW_S2=0</par>
      <par>fk27_formkuehl.svFK34HK1process.FK34_CirX_Data[1].FK34_SW_FW_S3=0</par>
      <par>fk27_formkuehl.svFK34HK1process.FK34_CirX_Data[1].FK34_SW_FW_S4=0</par>
      <par>fk27_formkuehl.svFK34HK1process.FK34_CirX_Data[1].FK34_SW_FW_S5=0</par>
      <par>fk27_formkuehl.svFK34HK1process.FK34_CirX_Data[1].FK34_SW_FW_S6=0</par>
      <par>fk27_formkuehl.svFK34HK1process.FK34_CirX_Data[1].FK34_SW_FW_S7=0</par>
      <par>fk27_formkuehl.svFK34HK1process.FK34_CirX_Data[1].FK34_SW_FW_S8=0</par>
      <par>fk27_formkuehl.svFK34HK1process.FK34_CirX_Data[1].FK34_T_COOL=0</par>
      <par>fk27_formkuehl.svFK34HK1process.FK34_CirX_Data[1].FK34_T_LEAK=0</par>
      <par>fk27_formkuehl.svFK34HK1process.FK34_CirX_Data[1].FK34_T_LEAK_R=0</par>
      <par>fk27_formkuehl.svFK34HK1process.FK34_CirX_Data[1].FK34_T_PREL=0</par>
      <par>fk27_formkuehl.svFK34HK1process.FK34_CirX_Data[1].FK34_T_RINSE=0</par>
      <par>fk27_formkuehl.svFK34HK1process.FK34_CirX_Data[1].FK34_T_RINSE_R=0</par>
      <par>fk27_formkuehl.svFK34HK1process.FK34_CirX_Data[1].FK34_T_START_R=0</par>
      <par>fk27_formkuehl.svFK34HK1process.FK34_CirX_Data[2].FK34_SW_CIR=0</par>
      <par>fk27_formkuehl.svFK34HK1process.FK34_CirX_Data[2].FK34_SW_FW_S1=0</par>
      <par>fk27_formkuehl.svFK34HK1process.FK34_CirX_Data[2].FK34_SW_FW_S2=0</par>
      <par>fk27_formkuehl.svFK34HK1process.FK34_CirX_Data[2].FK34_SW_FW_S3=0</par>
      <par>fk27_formkuehl.svFK34HK1process.FK34_CirX_Data[2].FK34_SW_FW_S4=0</par>
      <par>fk27_formkuehl.svFK34HK1process.FK34_CirX_Data[2].FK34_SW_FW_S5=0</par>
      <par>fk27_formkuehl.svFK34HK1process.FK34_CirX_Data[2].FK34_SW_FW_S6=0</par>
      <par>fk27_formkuehl.svFK34HK1process.FK34_CirX_Data[2].FK34_SW_FW_S7=0</par>
      <par>fk27_formkuehl.svFK34HK1process.FK34_CirX_Data[2].FK34_SW_FW_S8=0</par>
      <par>fk27_formkuehl.svFK34HK1process.FK34_CirX_Data[2].FK34_T_COOL=0</par>
      <par>fk27_formkuehl.svFK34HK1process.FK34_CirX_Data[2].FK34_T_LEAK=0</par>
      <par>fk27_formkuehl.svFK34HK1process.FK34_CirX_Data[2].FK34_T_LEAK_R=0</par>
      <par>fk27_formkuehl.svFK34HK1process.FK34_CirX_Data[2].FK34_T_PREL=0</par>
      <par>fk27_formkuehl.svFK34HK1process.FK34_CirX_Data[2].FK34_T_RINSE=0</par>
      <par>fk27_formkuehl.svFK34HK1process.FK34_CirX_Data[2].FK34_T_RINSE_R=0</par>
      <par>fk27_formkuehl.svFK34HK1process.FK34_CirX_Data[2].FK34_T_START_R=0</par>
      <par>fk27_formkuehl.svFK34HK1process.FK34_CirX_Data[3].FK34_SW_CIR=0</par>
      <par>fk27_formkuehl.svFK34HK1process.FK34_CirX_Data[3].FK34_SW_FW_S1=0</par>
      <par>fk27_formkuehl.svFK34HK1process.FK34_CirX_Data[3].FK34_SW_FW_S2=0</par>
      <par>fk27_formkuehl.svFK34HK1process.FK34_CirX_Data[3].FK34_SW_FW_S3=0</par>
      <par>fk27_formkuehl.svFK34HK1process.FK34_CirX_Data[3].FK34_SW_FW_S4=0</par>
      <par>fk27_formkuehl.svFK34HK1process.FK34_CirX_Data[3].FK34_SW_FW_S5=0</par>
      <par>fk27_formkuehl.svFK34HK1process.FK34_CirX_Data[3].FK34_SW_FW_S6=0</par>
      <par>fk27_formkuehl.svFK34HK1process.FK34_CirX_Data[3].FK34_SW_FW_S7=0</par>
      <par>fk27_formkuehl.svFK34HK1process.FK34_CirX_Data[3].FK34_SW_FW_S8=0</par>
      <par>fk27_formkuehl.svFK34HK1process.FK34_CirX_Data[3].FK34_T_COOL=0</par>
      <par>fk27_formkuehl.svFK34HK1process.FK34_CirX_Data[3].FK34_T_LEAK=0</par>
      <par>fk27_formkuehl.svFK34HK1process.FK34_CirX_Data[3].FK34_T_LEAK_R=0</par>
      <par>fk27_formkuehl.svFK34HK1process.FK34_CirX_Data[3].FK34_T_PREL=0</par>
      <par>fk27_formkuehl.svFK34HK1process.FK34_CirX_Data[3].FK34_T_RINSE=0</par>
      <par>fk27_formkuehl.svFK34HK1process.FK34_CirX_Data[3].FK34_T_RINSE_R=0</par>
      <par>fk27_formkuehl.svFK34HK1process.FK34_CirX_Data[3].FK34_T_START_R=0</par>
      <par>fk27_formkuehl.svFK34HK1process.FK34_CirX_Data[4].FK34_SW_CIR=0</par>
      <par>fk27_formkuehl.svFK34HK1process.FK34_CirX_Data[4].FK34_SW_FW_S1=0</par>
      <par>fk27_formkuehl.svFK34HK1process.FK34_CirX_Data[4].FK34_SW_FW_S2=0</par>
      <par>fk27_formkuehl.svFK34HK1process.FK34_CirX_Data[4].FK34_SW_FW_S3=0</par>
      <par>fk27_formkuehl.svFK34HK1process.FK34_CirX_Data[4].FK34_SW_FW_S4=0</par>
      <par>fk27_formkuehl.svFK34HK1process.FK34_CirX_Data[4].FK34_SW_FW_S5=0</par>
      <par>fk27_formkuehl.svFK34HK1process.FK34_CirX_Data[4].FK34_SW_FW_S6=0</par>
      <par>fk27_formkuehl.svFK34HK1process.FK34_CirX_Data[4].FK34_SW_FW_S7=0</par>
      <par>fk27_formkuehl.svFK34HK1process.FK34_CirX_Data[4].FK34_SW_FW_S8=0</par>
      <par>fk27_formkuehl.svFK34HK1process.FK34_CirX_Data[4].FK34_T_COOL=0</par>
      <par>fk27_formkuehl.svFK34HK1process.FK34_CirX_Data[4].FK34_T_LEAK=0</par>
      <par>fk27_formkuehl.svFK34HK1process.FK34_CirX_Data[4].FK34_T_LEAK_R=0</par>
      <par>fk27_formkuehl.svFK34HK1process.FK34_CirX_Data[4].FK34_T_PREL=0</par>
      <par>fk27_formkuehl.svFK34HK1process.FK34_CirX_Data[4].FK34_T_RINSE=0</par>
      <par>fk27_formkuehl.svFK34HK1process.FK34_CirX_Data[4].FK34_T_RINSE_R=0</par>
      <par>fk27_formkuehl.svFK34HK1process.FK34_CirX_Data[4].FK34_T_START_R=0</par>
      <par>fk27_formkuehl.svFK34HK1process.FK34_MAX_FLOWAL=0</par>
      <par>fk27_formkuehl.svFK34HK1process.FK34_SW_COOLPS=0</par>
      <par>fk27_formkuehl.svFK34HK1process.FK34_SW_HK_ON=0</par>
      <par>fk27_formkuehl.svFK34HK1process.FK34_S_I_START=1.0</par>
      <par>fk27_formkuehl.svFK34HK1process.FK34_T_IMPDAU=0</par>
      <par>fk27_formkuehl.svFK34HK2process.FK34_CirX_Data[1].FK34_SW_CIR=0</par>
      <par>fk27_formkuehl.svFK34HK2process.FK34_CirX_Data[1].FK34_SW_FW_S1=0</par>
      <par>fk27_formkuehl.svFK34HK2process.FK34_CirX_Data[1].FK34_SW_FW_S2=0</par>
      <par>fk27_formkuehl.svFK34HK2process.FK34_CirX_Data[1].FK34_SW_FW_S3=0</par>
      <par>fk27_formkuehl.svFK34HK2process.FK34_CirX_Data[1].FK34_SW_FW_S4=0</par>
      <par>fk27_formkuehl.svFK34HK2process.FK34_CirX_Data[1].FK34_SW_FW_S5=0</par>
      <par>fk27_formkuehl.svFK34HK2process.FK34_CirX_Data[1].FK34_SW_FW_S6=0</par>
      <par>fk27_formkuehl.svFK34HK2process.FK34_CirX_Data[1].FK34_SW_FW_S7=0</par>
      <par>fk27_formkuehl.svFK34HK2process.FK34_CirX_Data[1].FK34_SW_FW_S8=0</par>
      <par>fk27_formkuehl.svFK34HK2process.FK34_CirX_Data[1].FK34_T_COOL=0</par>
      <par>fk27_formkuehl.svFK34HK2process.FK34_CirX_Data[1].FK34_T_LEAK=0</par>
      <par>fk27_formkuehl.svFK34HK2process.FK34_CirX_Data[1].FK34_T_LEAK_R=0</par>
      <par>fk27_formkuehl.svFK34HK2process.FK34_CirX_Data[1].FK34_T_PREL=0</par>
      <par>fk27_formkuehl.svFK34HK2process.FK34_CirX_Data[1].FK34_T_RINSE=0</par>
      <par>fk27_formkuehl.svFK34HK2process.FK34_CirX_Data[1].FK34_T_RINSE_R=0</par>
      <par>fk27_formkuehl.svFK34HK2process.FK34_CirX_Data[1].FK34_T_START_R=0</par>
      <par>fk27_formkuehl.svFK34HK2process.FK34_CirX_Data[2].FK34_SW_CIR=0</par>
      <par>fk27_formkuehl.svFK34HK2process.FK34_CirX_Data[2].FK34_SW_FW_S1=0</par>
      <par>fk27_formkuehl.svFK34HK2process.FK34_CirX_Data[2].FK34_SW_FW_S2=0</par>
      <par>fk27_formkuehl.svFK34HK2process.FK34_CirX_Data[2].FK34_SW_FW_S3=0</par>
      <par>fk27_formkuehl.svFK34HK2process.FK34_CirX_Data[2].FK34_SW_FW_S4=0</par>
      <par>fk27_formkuehl.svFK34HK2process.FK34_CirX_Data[2].FK34_SW_FW_S5=0</par>
      <par>fk27_formkuehl.svFK34HK2process.FK34_CirX_Data[2].FK34_SW_FW_S6=0</par>
      <par>fk27_formkuehl.svFK34HK2process.FK34_CirX_Data[2].FK34_SW_FW_S7=0</par>
      <par>fk27_formkuehl.svFK34HK2process.FK34_CirX_Data[2].FK34_SW_FW_S8=0</par>
      <par>fk27_formkuehl.svFK34HK2process.FK34_CirX_Data[2].FK34_T_COOL=0</par>
      <par>fk27_formkuehl.svFK34HK2process.FK34_CirX_Data[2].FK34_T_LEAK=0</par>
      <par>fk27_formkuehl.svFK34HK2process.FK34_CirX_Data[2].FK34_T_LEAK_R=0</par>
      <par>fk27_formkuehl.svFK34HK2process.FK34_CirX_Data[2].FK34_T_PREL=0</par>
      <par>fk27_formkuehl.svFK34HK2process.FK34_CirX_Data[2].FK34_T_RINSE=0</par>
      <par>fk27_formkuehl.svFK34HK2process.FK34_CirX_Data[2].FK34_T_RINSE_R=0</par>
      <par>fk27_formkuehl.svFK34HK2process.FK34_CirX_Data[2].FK34_T_START_R=0</par>
      <par>fk27_formkuehl.svFK34HK2process.FK34_CirX_Data[3].FK34_SW_CIR=0</par>
      <par>fk27_formkuehl.svFK34HK2process.FK34_CirX_Data[3].FK34_SW_FW_S1=0</par>
      <par>fk27_formkuehl.svFK34HK2process.FK34_CirX_Data[3].FK34_SW_FW_S2=0</par>
      <par>fk27_formkuehl.svFK34HK2process.FK34_CirX_Data[3].FK34_SW_FW_S3=0</par>
      <par>fk27_formkuehl.svFK34HK2process.FK34_CirX_Data[3].FK34_SW_FW_S4=0</par>
      <par>fk27_formkuehl.svFK34HK2process.FK34_CirX_Data[3].FK34_SW_FW_S5=0</par>
      <par>fk27_formkuehl.svFK34HK2process.FK34_CirX_Data[3].FK34_SW_FW_S6=0</par>
      <par>fk27_formkuehl.svFK34HK2process.FK34_CirX_Data[3].FK34_SW_FW_S7=0</par>
      <par>fk27_formkuehl.svFK34HK2process.FK34_CirX_Data[3].FK34_SW_FW_S8=0</par>
      <par>fk27_formkuehl.svFK34HK2process.FK34_CirX_Data[3].FK34_T_COOL=0</par>
      <par>fk27_formkuehl.svFK34HK2process.FK34_CirX_Data[3].FK34_T_LEAK=0</par>
      <par>fk27_formkuehl.svFK34HK2process.FK34_CirX_Data[3].FK34_T_LEAK_R=0</par>
      <par>fk27_formkuehl.svFK34HK2process.FK34_CirX_Data[3].FK34_T_PREL=0</par>
      <par>fk27_formkuehl.svFK34HK2process.FK34_CirX_Data[3].FK34_T_RINSE=0</par>
      <par>fk27_formkuehl.svFK34HK2process.FK34_CirX_Data[3].FK34_T_RINSE_R=0</par>
      <par>fk27_formkuehl.svFK34HK2process.FK34_CirX_Data[3].FK34_T_START_R=0</par>
      <par>fk27_formkuehl.svFK34HK2process.FK34_CirX_Data[4].FK34_SW_CIR=0</par>
      <par>fk27_formkuehl.svFK34HK2process.FK34_CirX_Data[4].FK34_SW_FW_S1=0</par>
      <par>fk27_formkuehl.svFK34HK2process.FK34_CirX_Data[4].FK34_SW_FW_S2=0</par>
      <par>fk27_formkuehl.svFK34HK2process.FK34_CirX_Data[4].FK34_SW_FW_S3=0</par>
      <par>fk27_formkuehl.svFK34HK2process.FK34_CirX_Data[4].FK34_SW_FW_S4=0</par>
      <par>fk27_formkuehl.svFK34HK2process.FK34_CirX_Data[4].FK34_SW_FW_S5=0</par>
      <par>fk27_formkuehl.svFK34HK2process.FK34_CirX_Data[4].FK34_SW_FW_S6=0</par>
      <par>fk27_formkuehl.svFK34HK2process.FK34_CirX_Data[4].FK34_SW_FW_S7=0</par>
      <par>fk27_formkuehl.svFK34HK2process.FK34_CirX_Data[4].FK34_SW_FW_S8=0</par>
      <par>fk27_formkuehl.svFK34HK2process.FK34_CirX_Data[4].FK34_T_COOL=0</par>
      <par>fk27_formkuehl.svFK34HK2process.FK34_CirX_Data[4].FK34_T_LEAK=0</par>
      <par>fk27_formkuehl.svFK34HK2process.FK34_CirX_Data[4].FK34_T_LEAK_R=0</par>
      <par>fk27_formkuehl.svFK34HK2process.FK34_CirX_Data[4].FK34_T_PREL=0</par>
      <par>fk27_formkuehl.svFK34HK2process.FK34_CirX_Data[4].FK34_T_RINSE=0</par>
      <par>fk27_formkuehl.svFK34HK2process.FK34_CirX_Data[4].FK34_T_RINSE_R=0</par>
      <par>fk27_formkuehl.svFK34HK2process.FK34_CirX_Data[4].FK34_T_START_R=0</par>
      <par>fk27_formkuehl.svFK34HK2process.FK34_MAX_FLOWAL=0</par>
      <par>fk27_formkuehl.svFK34HK2process.FK34_SW_COOLPS=0</par>
      <par>fk27_formkuehl.svFK34HK2process.FK34_SW_HK_ON=0</par>
      <par>fk27_formkuehl.svFK34HK2process.FK34_S_I_START=1.0</par>
      <par>fk27_formkuehl.svFK34HK2process.FK34_T_IMPDAU=0</par>
      <par>fk27_formkuehl.svFK34HK3process.FK34_CirX_Data[1].FK34_SW_CIR=0</par>
      <par>fk27_formkuehl.svFK34HK3process.FK34_CirX_Data[1].FK34_SW_FW_S1=0</par>
      <par>fk27_formkuehl.svFK34HK3process.FK34_CirX_Data[1].FK34_SW_FW_S2=0</par>
      <par>fk27_formkuehl.svFK34HK3process.FK34_CirX_Data[1].FK34_SW_FW_S3=0</par>
      <par>fk27_formkuehl.svFK34HK3process.FK34_CirX_Data[1].FK34_SW_FW_S4=0</par>
      <par>fk27_formkuehl.svFK34HK3process.FK34_CirX_Data[1].FK34_SW_FW_S5=0</par>
      <par>fk27_formkuehl.svFK34HK3process.FK34_CirX_Data[1].FK34_SW_FW_S6=0</par>
      <par>fk27_formkuehl.svFK34HK3process.FK34_CirX_Data[1].FK34_SW_FW_S7=0</par>
      <par>fk27_formkuehl.svFK34HK3process.FK34_CirX_Data[1].FK34_SW_FW_S8=0</par>
      <par>fk27_formkuehl.svFK34HK3process.FK34_CirX_Data[1].FK34_T_COOL=0</par>
      <par>fk27_formkuehl.svFK34HK3process.FK34_CirX_Data[1].FK34_T_LEAK=0</par>
      <par>fk27_formkuehl.svFK34HK3process.FK34_CirX_Data[1].FK34_T_LEAK_R=0</par>
      <par>fk27_formkuehl.svFK34HK3process.FK34_CirX_Data[1].FK34_T_PREL=0</par>
      <par>fk27_formkuehl.svFK34HK3process.FK34_CirX_Data[1].FK34_T_RINSE=0</par>
      <par>fk27_formkuehl.svFK34HK3process.FK34_CirX_Data[1].FK34_T_RINSE_R=0</par>
      <par>fk27_formkuehl.svFK34HK3process.FK34_CirX_Data[1].FK34_T_START_R=0</par>
      <par>fk27_formkuehl.svFK34HK3process.FK34_CirX_Data[2].FK34_SW_CIR=0</par>
      <par>fk27_formkuehl.svFK34HK3process.FK34_CirX_Data[2].FK34_SW_FW_S1=0</par>
      <par>fk27_formkuehl.svFK34HK3process.FK34_CirX_Data[2].FK34_SW_FW_S2=0</par>
      <par>fk27_formkuehl.svFK34HK3process.FK34_CirX_Data[2].FK34_SW_FW_S3=0</par>
      <par>fk27_formkuehl.svFK34HK3process.FK34_CirX_Data[2].FK34_SW_FW_S4=0</par>
      <par>fk27_formkuehl.svFK34HK3process.FK34_CirX_Data[2].FK34_SW_FW_S5=0</par>
      <par>fk27_formkuehl.svFK34HK3process.FK34_CirX_Data[2].FK34_SW_FW_S6=0</par>
      <par>fk27_formkuehl.svFK34HK3process.FK34_CirX_Data[2].FK34_SW_FW_S7=0</par>
      <par>fk27_formkuehl.svFK34HK3process.FK34_CirX_Data[2].FK34_SW_FW_S8=0</par>
      <par>fk27_formkuehl.svFK34HK3process.FK34_CirX_Data[2].FK34_T_COOL=0</par>
      <par>fk27_formkuehl.svFK34HK3process.FK34_CirX_Data[2].FK34_T_LEAK=0</par>
      <par>fk27_formkuehl.svFK34HK3process.FK34_CirX_Data[2].FK34_T_LEAK_R=0</par>
      <par>fk27_formkuehl.svFK34HK3process.FK34_CirX_Data[2].FK34_T_PREL=0</par>
      <par>fk27_formkuehl.svFK34HK3process.FK34_CirX_Data[2].FK34_T_RINSE=0</par>
      <par>fk27_formkuehl.svFK34HK3process.FK34_CirX_Data[2].FK34_T_RINSE_R=0</par>
      <par>fk27_formkuehl.svFK34HK3process.FK34_CirX_Data[2].FK34_T_START_R=0</par>
      <par>fk27_formkuehl.svFK34HK3process.FK34_CirX_Data[3].FK34_SW_CIR=0</par>
      <par>fk27_formkuehl.svFK34HK3process.FK34_CirX_Data[3].FK34_SW_FW_S1=0</par>
      <par>fk27_formkuehl.svFK34HK3process.FK34_CirX_Data[3].FK34_SW_FW_S2=0</par>
      <par>fk27_formkuehl.svFK34HK3process.FK34_CirX_Data[3].FK34_SW_FW_S3=0</par>
      <par>fk27_formkuehl.svFK34HK3process.FK34_CirX_Data[3].FK34_SW_FW_S4=0</par>
      <par>fk27_formkuehl.svFK34HK3process.FK34_CirX_Data[3].FK34_SW_FW_S5=0</par>
      <par>fk27_formkuehl.svFK34HK3process.FK34_CirX_Data[3].FK34_SW_FW_S6=0</par>
      <par>fk27_formkuehl.svFK34HK3process.FK34_CirX_Data[3].FK34_SW_FW_S7=0</par>
      <par>fk27_formkuehl.svFK34HK3process.FK34_CirX_Data[3].FK34_SW_FW_S8=0</par>
      <par>fk27_formkuehl.svFK34HK3process.FK34_CirX_Data[3].FK34_T_COOL=0</par>
      <par>fk27_formkuehl.svFK34HK3process.FK34_CirX_Data[3].FK34_T_LEAK=0</par>
      <par>fk27_formkuehl.svFK34HK3process.FK34_CirX_Data[3].FK34_T_LEAK_R=0</par>
      <par>fk27_formkuehl.svFK34HK3process.FK34_CirX_Data[3].FK34_T_PREL=0</par>
      <par>fk27_formkuehl.svFK34HK3process.FK34_CirX_Data[3].FK34_T_RINSE=0</par>
      <par>fk27_formkuehl.svFK34HK3process.FK34_CirX_Data[3].FK34_T_RINSE_R=0</par>
      <par>fk27_formkuehl.svFK34HK3process.FK34_CirX_Data[3].FK34_T_START_R=0</par>
      <par>fk27_formkuehl.svFK34HK3process.FK34_CirX_Data[4].FK34_SW_CIR=0</par>
      <par>fk27_formkuehl.svFK34HK3process.FK34_CirX_Data[4].FK34_SW_FW_S1=0</par>
      <par>fk27_formkuehl.svFK34HK3process.FK34_CirX_Data[4].FK34_SW_FW_S2=0</par>
      <par>fk27_formkuehl.svFK34HK3process.FK34_CirX_Data[4].FK34_SW_FW_S3=0</par>
      <par>fk27_formkuehl.svFK34HK3process.FK34_CirX_Data[4].FK34_SW_FW_S4=0</par>
      <par>fk27_formkuehl.svFK34HK3process.FK34_CirX_Data[4].FK34_SW_FW_S5=0</par>
      <par>fk27_formkuehl.svFK34HK3process.FK34_CirX_Data[4].FK34_SW_FW_S6=0</par>
      <par>fk27_formkuehl.svFK34HK3process.FK34_CirX_Data[4].FK34_SW_FW_S7=0</par>
      <par>fk27_formkuehl.svFK34HK3process.FK34_CirX_Data[4].FK34_SW_FW_S8=0</par>
      <par>fk27_formkuehl.svFK34HK3process.FK34_CirX_Data[4].FK34_T_COOL=0</par>
      <par>fk27_formkuehl.svFK34HK3process.FK34_CirX_Data[4].FK34_T_LEAK=0</par>
      <par>fk27_formkuehl.svFK34HK3process.FK34_CirX_Data[4].FK34_T_LEAK_R=0</par>
      <par>fk27_formkuehl.svFK34HK3process.FK34_CirX_Data[4].FK34_T_PREL=0</par>
      <par>fk27_formkuehl.svFK34HK3process.FK34_CirX_Data[4].FK34_T_RINSE=0</par>
      <par>fk27_formkuehl.svFK34HK3process.FK34_CirX_Data[4].FK34_T_RINSE_R=0</par>
      <par>fk27_formkuehl.svFK34HK3process.FK34_CirX_Data[4].FK34_T_START_R=0</par>
      <par>fk27_formkuehl.svFK34HK3process.FK34_MAX_FLOWAL=0</par>
      <par>fk27_formkuehl.svFK34HK3process.FK34_SW_COOLPS=0</par>
      <par>fk27_formkuehl.svFK34HK3process.FK34_SW_HK_ON=0</par>
      <par>fk27_formkuehl.svFK34HK3process.FK34_S_I_START=1.0</par>
      <par>fk27_formkuehl.svFK34HK3process.FK34_T_IMPDAU=0</par>
      <par>fk27_formkuehl.svFK34HK4process.FK34_CirX_Data[1].FK34_SW_CIR=0</par>
      <par>fk27_formkuehl.svFK34HK4process.FK34_CirX_Data[1].FK34_SW_FW_S1=0</par>
      <par>fk27_formkuehl.svFK34HK4process.FK34_CirX_Data[1].FK34_SW_FW_S2=0</par>
      <par>fk27_formkuehl.svFK34HK4process.FK34_CirX_Data[1].FK34_SW_FW_S3=0</par>
      <par>fk27_formkuehl.svFK34HK4process.FK34_CirX_Data[1].FK34_SW_FW_S4=0</par>
      <par>fk27_formkuehl.svFK34HK4process.FK34_CirX_Data[1].FK34_SW_FW_S5=0</par>
      <par>fk27_formkuehl.svFK34HK4process.FK34_CirX_Data[1].FK34_SW_FW_S6=0</par>
      <par>fk27_formkuehl.svFK34HK4process.FK34_CirX_Data[1].FK34_SW_FW_S7=0</par>
      <par>fk27_formkuehl.svFK34HK4process.FK34_CirX_Data[1].FK34_SW_FW_S8=0</par>
      <par>fk27_formkuehl.svFK34HK4process.FK34_CirX_Data[1].FK34_T_COOL=0</par>
      <par>fk27_formkuehl.svFK34HK4process.FK34_CirX_Data[1].FK34_T_LEAK=0</par>
      <par>fk27_formkuehl.svFK34HK4process.FK34_CirX_Data[1].FK34_T_LEAK_R=0</par>
      <par>fk27_formkuehl.svFK34HK4process.FK34_CirX_Data[1].FK34_T_PREL=0</par>
      <par>fk27_formkuehl.svFK34HK4process.FK34_CirX_Data[1].FK34_T_RINSE=0</par>
      <par>fk27_formkuehl.svFK34HK4process.FK34_CirX_Data[1].FK34_T_RINSE_R=0</par>
      <par>fk27_formkuehl.svFK34HK4process.FK34_CirX_Data[1].FK34_T_START_R=0</par>
      <par>fk27_formkuehl.svFK34HK4process.FK34_CirX_Data[2].FK34_SW_CIR=0</par>
      <par>fk27_formkuehl.svFK34HK4process.FK34_CirX_Data[2].FK34_SW_FW_S1=0</par>
      <par>fk27_formkuehl.svFK34HK4process.FK34_CirX_Data[2].FK34_SW_FW_S2=0</par>
      <par>fk27_formkuehl.svFK34HK4process.FK34_CirX_Data[2].FK34_SW_FW_S3=0</par>
      <par>fk27_formkuehl.svFK34HK4process.FK34_CirX_Data[2].FK34_SW_FW_S4=0</par>
      <par>fk27_formkuehl.svFK34HK4process.FK34_CirX_Data[2].FK34_SW_FW_S5=0</par>
      <par>fk27_formkuehl.svFK34HK4process.FK34_CirX_Data[2].FK34_SW_FW_S6=0</par>
      <par>fk27_formkuehl.svFK34HK4process.FK34_CirX_Data[2].FK34_SW_FW_S7=0</par>
      <par>fk27_formkuehl.svFK34HK4process.FK34_CirX_Data[2].FK34_SW_FW_S8=0</par>
      <par>fk27_formkuehl.svFK34HK4process.FK34_CirX_Data[2].FK34_T_COOL=0</par>
      <par>fk27_formkuehl.svFK34HK4process.FK34_CirX_Data[2].FK34_T_LEAK=0</par>
      <par>fk27_formkuehl.svFK34HK4process.FK34_CirX_Data[2].FK34_T_LEAK_R=0</par>
      <par>fk27_formkuehl.svFK34HK4process.FK34_CirX_Data[2].FK34_T_PREL=0</par>
      <par>fk27_formkuehl.svFK34HK4process.FK34_CirX_Data[2].FK34_T_RINSE=0</par>
      <par>fk27_formkuehl.svFK34HK4process.FK34_CirX_Data[2].FK34_T_RINSE_R=0</par>
      <par>fk27_formkuehl.svFK34HK4process.FK34_CirX_Data[2].FK34_T_START_R=0</par>
      <par>fk27_formkuehl.svFK34HK4process.FK34_CirX_Data[3].FK34_SW_CIR=0</par>
      <par>fk27_formkuehl.svFK34HK4process.FK34_CirX_Data[3].FK34_SW_FW_S1=0</par>
      <par>fk27_formkuehl.svFK34HK4process.FK34_CirX_Data[3].FK34_SW_FW_S2=0</par>
      <par>fk27_formkuehl.svFK34HK4process.FK34_CirX_Data[3].FK34_SW_FW_S3=0</par>
      <par>fk27_formkuehl.svFK34HK4process.FK34_CirX_Data[3].FK34_SW_FW_S4=0</par>
      <par>fk27_formkuehl.svFK34HK4process.FK34_CirX_Data[3].FK34_SW_FW_S5=0</par>
      <par>fk27_formkuehl.svFK34HK4process.FK34_CirX_Data[3].FK34_SW_FW_S6=0</par>
      <par>fk27_formkuehl.svFK34HK4process.FK34_CirX_Data[3].FK34_SW_FW_S7=0</par>
      <par>fk27_formkuehl.svFK34HK4process.FK34_CirX_Data[3].FK34_SW_FW_S8=0</par>
      <par>fk27_formkuehl.svFK34HK4process.FK34_CirX_Data[3].FK34_T_COOL=0</par>
      <par>fk27_formkuehl.svFK34HK4process.FK34_CirX_Data[3].FK34_T_LEAK=0</par>
      <par>fk27_formkuehl.svFK34HK4process.FK34_CirX_Data[3].FK34_T_LEAK_R=0</par>
      <par>fk27_formkuehl.svFK34HK4process.FK34_CirX_Data[3].FK34_T_PREL=0</par>
      <par>fk27_formkuehl.svFK34HK4process.FK34_CirX_Data[3].FK34_T_RINSE=0</par>
      <par>fk27_formkuehl.svFK34HK4process.FK34_CirX_Data[3].FK34_T_RINSE_R=0</par>
      <par>fk27_formkuehl.svFK34HK4process.FK34_CirX_Data[3].FK34_T_START_R=0</par>
      <par>fk27_formkuehl.svFK34HK4process.FK34_CirX_Data[4].FK34_SW_CIR=0</par>
      <par>fk27_formkuehl.svFK34HK4process.FK34_CirX_Data[4].FK34_SW_FW_S1=0</par>
      <par>fk27_formkuehl.svFK34HK4process.FK34_CirX_Data[4].FK34_SW_FW_S2=0</par>
      <par>fk27_formkuehl.svFK34HK4process.FK34_CirX_Data[4].FK34_SW_FW_S3=0</par>
      <par>fk27_formkuehl.svFK34HK4process.FK34_CirX_Data[4].FK34_SW_FW_S4=0</par>
      <par>fk27_formkuehl.svFK34HK4process.FK34_CirX_Data[4].FK34_SW_FW_S5=0</par>
      <par>fk27_formkuehl.svFK34HK4process.FK34_CirX_Data[4].FK34_SW_FW_S6=0</par>
      <par>fk27_formkuehl.svFK34HK4process.FK34_CirX_Data[4].FK34_SW_FW_S7=0</par>
      <par>fk27_formkuehl.svFK34HK4process.FK34_CirX_Data[4].FK34_SW_FW_S8=0</par>